27/09/2022 11.21.06,257,2021,Yes,It was accurately labelled,"Learning disease-related representations plays a critical role in image-based cancer diagnosis, due to its trustworthy, interpretable and good generalization power.","Learning disease-related representations plays a critical role in image-based cancer diagnosis, due to its trustworthy, interpretable and good generalization power. A good representation should not only be disentangled from the disease-irrelevant features, but also incorporate the information of lesion’s attributes (e.g., shape, margin) that are often identified first during cancer diagnosis clinically. To learn such a representation, we propose a Disentangle Auto-Encoder with Graph Convolutional Network (DAE-GCN), which adopts a disentangling mechanism with the guidance of a GCN model in the AE-based framework. ","For better representation learning, the disentanglement mechanism has been proved to be an effective way [1, 3, 12], since such a mechanism prompts different independent latent units to encode different independent ground truth generation factors that vary in the data [1]. Based on the above, to capture the disease-related features without mixing other irrelevant information, in this paper we propose a Disentangle Auto-Encoder with Graph Convolutional Network (DAE-GCN), which incorporates a disentangling mechanism into an AE framework, equipped with attribution data during training stage (the attributes are not provided during the test). ","Graph analysis, Supervised learning, Neural network","AUC, Accuracy",No,"Our dataset contains $$\{x_i,A_i,y_i\}_{i \in \{1,...,n\}}$$, in which x, A, y respectively denote the patch-level mass image, attributes (e.g., circumscribed-margin, round-shape, irregular-shape), and the binary disease label. ",Yes," DDSM 
But also uses 3 ""in house"" datasets","We consider both the public dataset DDSM [2] and three in-house datasets: Inhouse1, Inhouse2 and Inhouse3. For each dataset, the region of interests (ROIs) (malignant/benign masses) are cropped based on the annotations of radiologists the same as [9]1. For all datasets, we randomly2 divide the whole set into training, validation and testing as 8:1:1 in patient-wise. ",Don't know,"We consider both the public dataset DDSM [2] and three in-house datasets: Inhouse1, Inhouse2 and Inhouse3.",No,"To evaluate the effectiveness of our DAE-GCN, we verify it on the patch-level mammogram mass benign/malignant classification. We consider both the public dataset DDSM [2] and three in-house datasets: Inhouse1, Inhouse2 and Inhouse3. For each dataset, the region of interests (ROIs) (malignant/benign masses) are cropped based on the annotations of radiologists the same as [9]1. For all datasets, we randomly2 divide the whole set into training, validation and testing as 8:1:1 in patient-wise.",No,Nothing is mentioend,No,Nothing is mentioned,Yes,"This work was supported by MOST-2018AAA0102004, NSFC-61625201 and ZheJiang Province Key Research & Development Program (No. 2020C03073).",No,Nothing is mentioned,Yes,"From the introduction: 
For image-based disease benign/malignant diagnosis, it is crucial to learn the disease-related representation for prediction, due to the necessity of trustworthy (to patients), explainable (to clinicians) and good generalization ability in healthcare.",No,Nothing is mentioned,Yes,"To provide convenience for latter works, we publish our spitted test set of DDSM [2] in supplementary.",
27/09/2022 11.27.05,258,2021,Yes,It was accurately labelled,"Ultrasound (US) imaging is a fundamental modality for detecting and diagnosing breast lesions, while shear-wave elastography (SWE) serves as a crucial complementary counterpart. Although an automated breast lesion classification system is desired, training of such a system is constrained by data scarcity and modality imbalance problems due to the lack of SWE devices in rural hospitals. ","To enhance the diagnosis with only US available, in this work, we propose a knowledge-guided data augmentation framework, which consists of a modal translater and a semantic inverter, achieving cross-modal and semantic data augmentation simultaneously. ","Breast cancer, the most commonly diagnosed cancer, is the fifth leading cause of cancer death all over the world [24].",Neural network,"AUC, Accuracy, Precision, Recall, F1 score",No,Nothing is mentioned,No,"From September 2020 to January 2021, a total of 2,008 images of benign lesions and 1,466 images of malignant lesions from 593 patients were collected as the dataset used in this paper. ","From September 2020 to January 2021, a total of 2,008 images of benign lesions and 1,466 images of malignant lesions from 593 patients were collected as the dataset used in this paper. ",Private,"From September 2020 to January 2021, a total of 2,008 images of benign lesions and 1,466 images of malignant lesions from 593 patients were collected as the dataset used in this paper. ",Yes,"The Super Linear SL-15-4 probe of ultrafast ultrasound device Aixplorer (Super Sonic Imagine, Aix-en-Provence, France) was used for imaging data collection. The maximum stiffness scale of SWE images was selected as 180 Kilopascal (kPa). ",No,Nothing is mentioned,Yes,"From September 2020 to January 2021, a total of 2,008 images of benign lesions and 1,466 images of malignant lesions from 593 patients were collected as the dataset used in this paper. ",Yes,"This work was supported in part by Shanghai Municipal Science and Technology Major Project (2021SHZDZX0102), 111 project (BP0719010), Shanghai Science and Technology Committee (18DZ2270700) and Shanghai Jiao Tong University Science and Technology Innovation Special Fund (ZH2018ZDA17).",No,Nothing is mentioned,No,Nothing is mentioned,No,Nothing is mentioned,Yes,"Electronic supplementary material
The online version of this chapter (https://​doi.​org/​10.​1007/​978-3-030-87240-3_​6) contains supplementary material, which is available to authorized users.",
27/09/2022 11.29.27,259,2021,No,Other medical imaging task,"Transfer learning is an important step to extract meaningful features and overcome the data limitation in the medical Visual Question Answering (VQA) task. However, most of the existing medical VQA methods rely on external data for transfer learning, while the meta-data within the dataset is not fully utilized. In this paper, we present a new multiple meta-model quantifying method that effectively learns meta-annotation and leverages meaningful features to the medical VQA task. Our proposed method is designed to increase meta-data by auto-annotation, deal with noisy labels, and output meta-models which provide robust features for medical VQA tasks. Extensively experimental results on two public medical VQA datasets show that our approach achieves superior accuracy in comparison with other state-of-the-art methods, while does not require external data to train meta-models.",,,,,,,,,,,,,,,,,,,,,,,,,,,,
27/09/2022 11.37.14,262,2021,Yes,It was accurately labelled,"In this paper, we propose a coherent cooperative learning framework based on transfer learning for unsupervised cross-domain classification.","In this paper, we propose a coherent cooperative learning framework based on transfer learning for unsupervised cross-domain classification.","In the practical application of medical image analysis, due to the different data distributions of source domain and target domain and the lack of the labels of target domain, domain adaptation for unsupervised cross-domain classification attracts widespread attention. However, current methods take knowledge transfer model and classification model as two separate training stages, which inadequately considers and utilizes the intrinsic information interaction between module","Unsupervised learning, Transfer learning, Neural network","Accuracy, Precision, Recall, F1 score",No,Nothing is mentioned,Yes,"We use three databases in the experiments, and their information is shown in Table 1. The Chest X-Ray1 is divided into training dataset and testing dataset [12]. Single lesion2 and Multiple lesions3 are the training datasets of two open lesion recognition competitions.","No quote, but there is Table 1 which includes the number of images of each used dataset",Public,"The Chest X-Ray1 is divided into training dataset and testing dataset [12]. Single lesion2 and Multiple lesions3 are the training datasets of two open lesion recognition competitions. (and I think the first one is also accessible, there is a link in the footnote)",No,Nothing is mentioned,No,Nothing is mentioned,No,Nothing is mentioned,No,"This work was supported in part by 2030 National Key Research and Development Program of China (2018AAA0100500), the National Nature Science Foundation of China (no. 61773166), Projects of International Cooperation of Shanghai Municipal Science and Technology Committee (14DZ2260800), the Fundamental Research Funds for the Central Universities, and the ECNU Academic Innovation Promotion Program for Excellent Doctoral Students (YBNLTS2021-040).",No,Nothing is mentioned,No,Nothing is mentioned,No,Nothing is mentioned,Yes,"Electronic supplementary material
The online version of this chapter (https://​doi.​org/​10.​1007/​978-3-030-87240-3_​10) contains supplementary material, which is available to authorized users.",
28/09/2022 09.54.15,15,2012,No,I don't know,,,,,,,,,,,,,,,,,,,,,,,,,,,,,"Don't know what this is, not classification I think...."
28/09/2022 10.03.14,16,2012,Yes,It was accurately labelled,"With the advent of advanced imaging techniques, genotyping,
and methods to assess clinical and biological progression, there is
a growing need for a unified framework that could exploit information
available from multiple sources to aid diagnosis and the identification
of early signs of Alzheimer’s disease (AD).","We propose a modeling
strategy using supervised feature extraction to optimally combine highdimensional
imaging modalities with several other low-dimensional disease
risk factors. The motivation is to discover new imaging biomarkers
and use them in conjunction with other known biomarkers for prognosis
of individuals at high risk of developing AD. Our framework also has the
ability to assess the relative importance of imaging modalities for predicting
AD conversion.","Mild cognitive impairment (MCI) is an intermediate stage between healthy aging
and dementia. Patients diagnosed with MCI are at high risk of developing
Alzheimer’s disease (AD), but not everyone with MCI will convert. Accurate
prognosis for MCI patients is an important prerequisite for providing the optimal
treatment and management of the disease.","SVM, Prediction of Conversion to AD: Distinguishing the probable convertors from the population of MCI is a binary classification problem. While there are several ways to look at this problem, we present here a formulation of the classifier supervised by the AD group and healthy control group (NL). In other words, the classifier is trained on the AD and NL but is used as a “recommender” for the test MCI subject. Based on the classification score obtained on the MCI subject, the prediction of the classifier is interpreted. We denote the test MCI subject as “AD-like” when the classifier recommends AD and treated as predicted MCI-C otherwise termed as “Stable-MCI” or predicted MCI-NC. The classifier accuracy is assessed by comparing the predicted MCI-C or MCI-NC status with the conversion status from the follow-up study for that test MCI subject. The proposed methodology is evaluated using the LDA, its quadratic variant–Quadratic Discriminant Analysis (QDA), and SVM as binary classifiers.","AUC, Specificity, Accuracy, Sensitivity",Yes,"Tissue-wise intensity normalization
for white matter, gray matter, and cerebrospinal fluid was performed using the expectation maximization based segmentation followed by the piecewise polynomial
histogram matching algorithm",Yes,"All the baseline and screening T1 weighted, bias-fieldcorrected
and N3 scaled structuralMagnetic Resonance Images were downloaded
from the Alzheimer’s Disease Neuroimaging Initiative (ADNI) database.","The baseline subjects that had all the clinical, APOE genotyping, FDG-PET
imaging and MRI imaging data from the ADNI database comprised of a total
of 242 individuals.",Public,ADNI is available upon request,No,Nothing is mentioned,No,Nothing is mentioned,No,Nothing is mentioned,Yes,"Data collection and sharing for this project was funded by
the Alzheimer’s Disease Neuroimaging Initiative (ADNI) (NIH Grant U01
AG024904).The research in this paper was supported byNIHgrant 5R01EB007688,
the University of California, San Francisco (NIH grantP41 RR023953),NSF grant
CNS-0751152), and NSF CAREER Grant 1054057.",No,Nothing is mentioned,No,Nothing is mentioned,No,Nothing is mentioned,No,Nothing is mentioned,
28/09/2022 10.14.36,17,2012,No,Other medical imaging task,,,,,,,,,,,,,,,,,,,,,,,,,,,,,Detection not classification
28/09/2022 10.21.37,19,2012,Yes,It was accurately labelled,"One important contribution of the method is
the provision of an interpretability layer, which is able to explain a particular
classification by visually mapping the most important visual patterns associated
with such classification.","A method for automatic analysis and interpretation of histopathology
images is presented. The method uses a representation of the image data
set based on bag of features histograms built from visual dictionary of Haarbased
patches and a novel visual latent semantic strategy for characterizing the
visual content of a set of images.","This paper presents a new method, ViSAI, for automatic analysis and interpretation of
histopathological images.","The method comprises three main stages: learning of an image representation based on bag of features (BOF), characterization of the rich visual variety of a histopathological image collection using visual latent topic analysis, and connection of visual patterns with the semantics of the problem using a probabilistic classification model.","Specificity, Accuracy, Sensitivity",No,Nothing is mentioned,No,"The dataset comprises 10 labeled histopathological cases from St. Jude Children’s Research
Hospital, which 5 are anaplastic and 5 are non-anaplastic","Each slide is a whole
virtual slide of 80000×80000 pixels with one or more cancerous regions with a large
tumoral variability, manually annotated by a neuro-pathologist. For every slide, 750
individual images of 200×200 pixels non-overlapping where extracted uniformly at
random from these cancerous regions, resulting in a database of 7500 different images:
half of them anaplastic.",Private,"The dataset comprises 10 labeled histopathological cases from St. Jude Children’s Research
Hospital, which 5 are anaplastic and 5 are non-anaplastic",No,Nothing is mentioned,No,Nothing is mentioned,No,Nothing is mentioned,No,Nothing is mentioned,No,Nothing is mentioned,No,Nothing is mentioned,No,Nothing is mentioned,No,Nothing is mentioned,
28/09/2022 11.32.22,20,2012,No,I don't know,,,,,,,,,,,,,,,,,,,,,,,,,,,,,No clue what this one is about :D
28/09/2022 11.40.00,25,2012,Yes,It was accurately labelled,"Classification of Ambiguous Nerve Fiber
Orientations in 3D Polarized Light Imaging","3D Polarized Light Imaging (3D-PLI) has been shown to
measure the orientation of nerve fibers in post mortem human brains at
ultra high resolution. The 3D orientation in each voxel is obtained as a
pair of angles, the direction angle and the inclination angle with unknown
sign. The sign ambiguity is a major problem for the correct interpretation
of fiber orientation. Measurements from a tiltable specimen stage, that
are highly sensitive to noise, extract information, which allows drawing
conclusions about the true inclination sign. In order to reduce noise, we
propose a global classification of the inclination sign, which combines
measurements with spatial coherence constraints.","Fiber tracts are composed of axons, which connect nerve cells between each
other, and thus transmit information between brain areas. The exact courses
of fiber tracts are still far from being fully understood.","Graph analysis, The problem is formulated as a second order Markov random field and solved efficiently with graph cuts.","Sensitivity, RMSD",No,Nothing is mentioned (but this article is insanely convoluted!),No,"We evaluate our approach on synthetic and human brain
data.","Human Brain Data. Regions in histological sections of three post mortem
brains without pathological findings were selected to demonstrate the different
behavior of all approaches (Fig. 4(b)–(d)).
Synthetic Data. A synthetic data set consisting of a direction image ˜ ϕ and an
inclination image ˜α was created. The structure consists of rounded and crossing
fiber tracts (Fig. 4(a))",Private,The synthetic data they construct themselves and no mention is made of the human brain data,Don't know,"Not sure if someone who understands this could recreate the synthetic data, the human data no",No,Nothing is mentioned,Yes,At least the synthetic data is created for this article,No,Nothing is mentioned,No,Nothing is mentioned,No,Nothing is mentioned,No,Nothing is mentioned,No,Nothing is mentioned,
28/09/2022 11.41.48,28,2012,No,Other medical imaging task,,,,,,,,,,,,,,,,,,,,,,,,,,,,,
28/09/2022 11.44.17,31,2012,No,Other medical imaging task,,,,,,,,,,,,,,,,,,,,,,,,,,,,,"One I understand the basics of - trying to sample from MRI's to get better data faster, but not directly anything to do with classification I would say"
29/09/2022 08.59.47,266,2021,Yes,It was accurately labelled,"Universal Lesion Detection (ULD) in computed tomography (CT) [1–14], which aims to localize different types of lesions instead of identifying lesion types [15–26], plays an essential role in computer-aided diagnosis (CAD","In this paper we propose a BM-based conditional training for two-stage ULD, which can (i) reduce positive vs. negative anchor imbalance via a BM-based conditioning (BMC) mechanism for anchor sampling instead of traditional IoU-based rule; and (ii) adaptively compute size-adaptive BM (ABM) M. de Bruijne et al. (eds.)Medical Image Computing and Computer Assisted Intervention – MICCAI 2021Image Processing, Computer Vision, Pattern Recognition, and Graphics12905
https://doi.org/10.1007/978-3-030-87240-3_14
Conditional Training with Bounding Map for Universal Lesion Detection
Han Li1, 2  , Long Chen2, 3  , Hu Han2  , Ying Chi4   and S. Kevin Zhou1, 2  
(1)
Medical Imaging, Robotics, Analytic Computing Laboratory/Engineering (MIRACLE), School of Biomedical Engineering & Suzhou Institute for Advanced Research, University of Science and Technology of China, Suzhou, China
(2)
Key Laboratory of Intelligent Information Processing of Chinese Academy of Sciences (CAS), Institute of Computing Technology, CAS, Beijing, China
(3)
School of Electronic, Electrical and Communication Engineering, University of the Chinese Academy of Science, Beijing, China
(4)
Healthcare Intelligence, AIC, DAMO Academy, Alibaba Group, Hangzhou, China
 
 
Han Li
Email: han.li@miracle.ict.ac.cn
 
Long Chen
Email: long.chen@miracle.ict.ac.cn
 
Hu Han (Corresponding author)
Email: hanhu@ict.ac.cn
 
Ying Chi
Email: xinyi.cy@alibaba-inc.com
Abstract
Universal Lesion Detection (ULD) in computed tomography plays an essential role in computer-aided diagnosis. Promising ULD results have been reported by coarse-to-fine two-stage detection approaches, but such two-stage ULD methods still suffer from issues like imbalance of positive v.s. negative anchors during object proposal and insufficient supervision problem during localization regression and classification of the region of interest (RoI) proposals. While leveraging pseudo segmentation masks such as bounding map (BM) can reduce the above issues to some degree, it is still an open problem to effectively handle the diverse lesion shapes and sizes in ULD. In this paper we propose a BM-based conditional training for two-stage ULD, which can (i) reduce positive vs. negative anchor imbalance via a BM-based conditioning (BMC) mechanism for anchor sampling instead of traditional IoU-based rule; and (ii) adaptively compute size-adaptive BM (ABM) from lesion bounding-box, which is used for improving lesion localization accuracy via ABM-supervised segmentation.",we propose a novel training mechanism for ULD to effectively reduce positive vs. negative anchor imbalance via a BM-based conditioning (BMC) mechanism in stage-1 and improve lesion localization accuracy by leveraging a size-adaptive BM (ABM) for supervising the segmentation branch in stage-2. ,"Different from the traditional IoU-based positive and negative anchors selection mechanism, we use two independent anchor classification and regression tasks by directly predicting a per-pixel objectness map and selecting positive anchors for regression based on BMs [11]. Specifically as shown in Fig. 1, we use the  $$BM_{xy}$$ [11] as objectness GT map and select anchors whose value is greater than a threshold B in $$BM_{xy}$$ to the region proposal network (RPN) for pixel-wise objectness map regression. We further randomly mask out some background pixels in $$BM_{xy}$$ during objectness training to keep the number of background pixels no more than two times of the foreground pixel number. In addition, we extend BM into size-adaptive BMs (ABMs) to handle diverse lesions, in which the small lesions will be enhanced to compensate its limited pixel number while the big lesions are weakened. We use an ABM-supervised segmentation branch in stage-2 to improve the lesion localization accuracy.",Sensitivity,Yes,"Sect. 2.2 introduces the BMC mechanism, and Sect. 2.3 explains the newly introduced ABM-supervised segmentation branch.",Yes,DeepLesion dataset,"The dataset contains 32,735 lesions on 32,120 axial slices from 10,594 CT studies of 4,427 unique patients. Most existing datasets typically focus on one type of lesion, while DeepLesion contains a variety of lesions with large diameters ranges (from 0.21 to 342.5 mm). The 12-bit intensity CT is rescaled to [0,255] with different window ranges settings used in different frameworks. Also, every CT slice is resized and interpolated according to the detection frameworks’ setting. We follow the official split, i.e., $$70\%$$ for training, $$15\%$$ for validation and $$15\%$$ for testing.",Public,Searching for it shows it can be found by anyone,Don't know,Nothing is mentioned,No,Nothing is mentioned,No,Nothing is mentioned,Yes,"This research was supported in part by the Natural Science Foundation of China (grant 61732004), Youth Innovation Promotion Association CAS (grant 2018135) and Alibaba Group through Alibaba Innovative Research Program.",No,Nothing is mentioned,No,Nothing is mentioned,No,Nothing is mentioned,Yes,"There is a doi in the electronic supplementary material, but still only available behind a paywall and am unsure how much more material is actually provided","I would say this is perhaps more classification adjacent, ULD seems to be about localizing different types of lesions, and is used for computer-aided diagnosis, but not as a stand alone part.. "
29/09/2022 09.20.10,266,2021,Yes,It was accurately labelled,"Unsupervised anomaly detection (UAD) learns one-class classifiers exclusively with normal (i.e., healthy) images to detect any abnormal (i.e., unhealthy) samples that do not conform to the expected normal patterns","we propose a novel self-supervised representation learning method, called Constrained Contrastive Distribution learning for anomaly detection (CCD), which learns fine-grained feature representations by simultaneously predicting the distribution of augmented data and image contexts using contrastive learning with pretext constraints. ","UAD has two main advantages over its fully supervised counterpart. Firstly, it is able to directly leverage large datasets available from health screening programs that contain mostly normal image samples, avoiding the costly manual labelling of abnormal samples and the subsequent issues involved in training with extremely class-imbalanced data. Further, UAD approaches can potentially detect and localise any type of lesions that deviate from the normal patterns. One significant challenge faced by UAD methods is how to learn effective low-dimensional image representations to detect and localise subtle abnormalities, generally consisting of small lesions. ","we propose Constrained Contrastive Distribution learning (CCD), a new self-supervised representation learning designed specifically to learn normality information from exclusively normal training images.",AUC,No,Nothing is mentioned,Yes,"They use three different datasets: Hyper-Kvasir, LAG, and Liu et al's colonoscopy dataset",Different sizes,Public,"But mixed, some public, some private",No,None of the used datasets are described in great detail,No,Nothing is mentioned,No,Nothing is mentioned,No,Nothing is mentioned,No,Nothing is mentioned,No,Nothing is mentioned,No,Nothing is mentioned,Yes,"Their code is freely available on github, link in abstract",
