,index,Title,Authors,Page numbers,DOI,Year of publication,Part of publication,category,Number of references,Oldest reference,Newest reference,Range of references
100,252,SurgeonAssist-Net: Towards Context-Aware Head-Mounted Display-Based Augmented Reality for Surgical Guidance,"Mitchell Doughty, Karan Singh, Nilesh R. Ghugre",667-677,/chapter/10.1007/978-3-030-87202-1_64,2021,4,category: classification,35,1997,2020,23
101,255,CA-Net: Leveraging Contextual Features for Lung Cancer Prediction,"Mingzhou Liu, Fandong Zhang, Xinwei Sun, Yizhou Yu, Yizhou Wang",23-32,/chapter/10.1007/978-3-030-87240-3_3,2021,5,category: classification,22,1991,2020,29
102,257,DAE-GCN: Identifying Disease-Related Features for Disease Prediction,"Churan Wang, Xinwei Sun, Fandong Zhang, Yizhou Yu, Yizhou Wang",43-52,/chapter/10.1007/978-3-030-87240-3_5,2021,5,category: classification,14,1996,2020,24
103,258,Enhanced Breast Lesion Classification via Knowledge Guided Cross-Modal and Semantic Data Augmentation,"Kun Chen, Yuanfan Guo, Canqian Yang, Yi Xu, Rui Zhang, Chunxiao Li et al.",53-63,/chapter/10.1007/978-3-030-87240-3_6,2021,5,category: classification,29,2003,2021,18
104,259,Multiple Meta-model Quantifying for Medical Visual Question Answering,"Tuong Do, Binh X. Nguyen, Erman Tjiputra, Minh Tran, Quang D. Tran, Anh Nguyen",64-74,/chapter/10.1007/978-3-030-87240-3_7,2021,5,category: classification,45,1987,2021,34
105,262,A Coherent Cooperative Learning Framework Based on Transfer Learning for Unsupervised Cross-Domain Classification,"Xinxin Shan, Ying Wen, Qingli Li, Yue Lu, Haibin Cai",96-106,/chapter/10.1007/978-3-030-87240-3_10,2021,5,category: classification,35,2010,2020,10
106,264,A Segmentation-Assisted Model for Universal Lesion Detection with Partial Labels,"Fei Lyu, Baoyao Yang, Andy J. Ma, Pong C. Yuen",117-127,/chapter/10.1007/978-3-030-87240-3_12,2021,5,category: classification,22,2009,2020,11
107,265,Constrained Contrastive Distribution Learning for Unsupervised Anomaly Detection and Localisation in Medical Images,"Yu Tian, Guansong Pang, Fengbei Liu, Yuanhong Chen, Seon Ho Shin, Johan W. Verjans et al.",128-140,/chapter/10.1007/978-3-030-87240-3_13,2021,5,category: classification,41,1999,2021,22
108,266,Conditional Training with Bounding Map for Universal Lesion Detection,"Han Li, Long Chen, Hu Han, Ying Chi, S. Kevin Zhou",141-152,/chapter/10.1007/978-3-030-87240-3_14,2021,5,category: classification,35,2015,2021,6
109,267,Focusing on Clinically Interpretable Features: Selective Attention Regularization for Liver Biopsy Image Classification,"Chong Yin, Siqi Liu, Rui Shao, Pong C. Yuen",153-162,/chapter/10.1007/978-3-030-87240-3_15,2021,5,category: classification,26,2005,2020,15
110,268,Categorical Relation-Preserving Contrastive Knowledge Distillation for Medical Image Classification,"Xiaohan Xing, Yuenan Hou, Hang Li, Yixuan Yuan, Hongsheng Li, Max Q.-H. Meng",163-173,/chapter/10.1007/978-3-030-87240-3_16,2021,5,category: classification,29,2014,2020,6
111,269,Tensor-Based Multi-index Representation Learning for Major Depression Disorder Detection with Resting-State fMRI,"Dongren Yao, Erkun Yang, Hao Guan, Jing Sui, Zhizhong Zhang, Mingxia Liu",174-184,/chapter/10.1007/978-3-030-87240-3_17,2021,5,category: classification,32,1972,2021,49
112,270,Region Ensemble Network for MCI Conversion Prediction with a Relation Regularized Loss,"Yuan-Xing Zhao, Yan-Ming Zhang, Ming Song, Cheng-Lin Liu",185-194,/chapter/10.1007/978-3-030-87240-3_18,2021,5,category: classification,21,1998,2020,22
113,271,Airway Anomaly Detection by Prototype-Based Graph Neural Network,"Tianyi Zhao, Zhaozheng Yin",195-204,/chapter/10.1007/978-3-030-87240-3_19,2021,5,category: classification,20,2000,2019,19
114,272,Energy-Based Supervised Hashing for Multimorbidity Image Retrieval,"Peng Huang, Xiuzhuang Zhou, Zeqiang Wei, Guodong Guo",205-214,/chapter/10.1007/978-3-030-87240-3_20,2021,5,category: classification,24,2004,2021,17
115,273,Stochastic 4D Flow Vector-Field Signatures: A New Approach for Comprehensive 4D Flow MRI Quantification,"Mohammed S. M. Elbaz, Chris Malaisrie, Patrick McCarthy, Michael Markl",215-224,/chapter/10.1007/978-3-030-87240-3_21,2021,5,category: classification,18,2000,2019,19
116,275,ASC-Net: Adversarial-Based Selective Network for Unsupervised Anomaly Segmentation,"Raunak Dey, Yi Hong",236-247,/chapter/10.1007/978-3-030-87240-3_23,2021,5,category: classification,28,1997,2021,24
117,276,Cost-Sensitive Meta-learning for Progress Prediction of Subjective Cognitive Decline with Brain Structural MRI,"Hao Guan, Yunbi Liu, Shifu Xiao, Ling Yue, Mingxia Liu",248-258,/chapter/10.1007/978-3-030-87240-3_24,2021,5,category: classification,28,2008,2021,13
118,277,Effective Pancreatic Cancer Screening on Non-contrast CT Scans via Anatomy-Aware Transformers,"Yingda Xia, Jiawen Yao, Le Lu, Lingyun Huang, Guotong Xie, Jing Xiao et al.",259-269,/chapter/10.1007/978-3-030-87240-3_25,2021,5,category: classification,29,2013,2021,8
119,278,Learning from Subjective Ratings Using Auto-Decoded Deep Latent Embeddings,"Bowen Li, Xinping Ren, Ke Yan, Le Lu, Lingyun Huang, Guotong Xie et al.",270-280,/chapter/10.1007/978-3-030-87240-3_26,2021,5,category: classification,25,1954,2021,67
120,279,VertNet: Accurate Vertebra Localization and Identification Network from CT Images,"Zhiming Cui, Changjian Li, Lei Yang, Chunfeng Lian, Feng Shi, Wenping Wang et al.",281-290,/chapter/10.1007/978-3-030-87240-3_27,2021,5,category: classification,18,2007,2021,14
121,280,VinDr-SpineXR: A Deep Learning Framework for Spinal Lesions Detection and Classification from Radiographs,"Hieu T. Nguyen, Hieu H. Pham, Nghia T. Nguyen, Ha Q. Nguyen, Thang Q. Huynh, Minh Dao et al.",291-301,/chapter/10.1007/978-3-030-87240-3_28,2021,5,category: classification,33,1950,2021,71
122,281,Multi-frame Collaboration for Effective Endoscopic Video Polyp Detection via Spatial-Temporal Feature Transformation,"Lingyun Wu, Zhiqiang Hu, Yuanfeng Ji, Ping Luo, Shaoting Zhang",302-312,/chapter/10.1007/978-3-030-87240-3_29,2021,5,category: classification,27,2008,2021,13
123,283,Balanced-MixUp for Highly Imbalanced Medical Image Classification,"Adrian Galdran, Gustavo Carneiro, Miguel A. González Ballester",323-333,/chapter/10.1007/978-3-030-87240-3_31,2021,5,category: classification,25,2002,2021,19
124,284,Transfer Learning of Deep Spatiotemporal Networks to Model Arbitrarily Long Videos of Seizures,"Fernando Pérez-García, Catherine Scott, Rachel Sparks, Beate Diehl, Sébastien Ourselin",334-344,/chapter/10.1007/978-3-030-87240-3_32,2021,5,category: classification,13,2002,2019,17
125,285,Retina-Match: Ipsilateral Mammography Lesion Matching in a Single Shot Detection Pipeline,"Yinhao Ren, Jiafeng Lu, Zisheng Liang, Lars J. Grimm, Connie Kim, Michael Taylor-Cho et al.",345-354,/chapter/10.1007/978-3-030-87240-3_33,2021,5,category: classification,20,2004,2020,16
126,286,Towards Robust Dual-View Transformation via Densifying Sparse Supervision for Mammography Lesion Matching,"Junlin Xian, Zhiwei Wang, Kwang-Ting Cheng, Xin Yang",355-365,/chapter/10.1007/978-3-030-87240-3_34,2021,5,category: classification,21,2006,2021,15
127,287,DeepOPG: Improving Orthopantomogram Finding Summarization with Weak Supervision,"Tzu-Ming Harry Hsu, Yin-Chih Chelsea Wang",366-376,/chapter/10.1007/978-3-030-87240-3_35,2021,5,category: classification,19,1992,2020,28
128,288,Joint Spinal Centerline Extraction and Curvature Estimation with Row-Wise Classification and Curve Graph Network,"Long Huo, Bin Cai, Pengpeng Liang, Zhiyong Sun, Chi Xiong, Chaoshi Niu et al.",377-386,/chapter/10.1007/978-3-030-87240-3_36,2021,5,category: classification,17,2015,2020,5
129,289,LDPolypVideo Benchmark: A Large-Scale Colonoscopy Video Dataset of Diverse Polyps,"Yiting Ma, Xuejin Chen, Kai Cheng, Yang Li, Bin Sun",387-396,/chapter/10.1007/978-3-030-87240-3_37,2021,5,category: classification,27,2004,2020,16
130,290,Continual Learning with Bayesian Model Based on a Fixed Pre-trained Feature Extractor,"Yang Yang, Zhiying Cui, Junjie Xu, Changhong Zhong, Ruixuan Wang, Wei-Shi Zheng",397-406,/chapter/10.1007/978-3-030-87240-3_38,2021,5,category: classification,20,2012,2020,8
131,291,Alleviating Data Imbalance Issue with Perturbed Input During Inference,"Kanghao Chen, Yifan Mao, Huijuan Lu, Chenghua Zeng, Ruixuan Wang, Wei-Shi Zheng",407-417,/chapter/10.1007/978-3-030-87240-3_39,2021,5,category: classification,28,1997,2020,23
132,292,A Deep Reinforced Tree-Traversal Agent for Coronary Artery Centerline Extraction,"Zhuowei Li, Qing Xia, Zhiqiang Hu, Wenji Wang, Lijian Xu, Shaoting Zhang",418-428,/chapter/10.1007/978-3-030-87240-3_40,2021,5,category: classification,21,1986,2019,33
133,294,Predicting Symptoms from Multiphasic MRI via Multi-instance Attention Learning for Hepatocellular Carcinoma Grading,"Zelin Qiu, Yongsheng Pan, Jie Wei, Dijia Wu, Yong Xia, Dinggang Shen",439-448,/chapter/10.1007/978-3-030-87240-3_42,2021,5,category: classification,23,2007,2021,14
134,295,Triplet-Branch Network with Prior-Knowledge Embedding for Fatigue Fracture Grading,"Yuexiang Li, Yanping Wang, Guang Lin, Yi Lin, Dong Wei, Qirui Zhang et al.",449-458,/chapter/10.1007/978-3-030-87240-3_43,2021,5,category: classification,15,2007,2020,13
135,297,Data Augmentation in Logit Space for Medical Image Classification with Limited Training Data,"Yangwen Hu, Zhehao Zhong, Ruixuan Wang, Hongmei Liu, Zhijun Tan, Wei-Shi Zheng",469-479,/chapter/10.1007/978-3-030-87240-3_45,2021,5,category: classification,28,1987,2021,34
136,298,Collaborative Image Synthesis and Disease Diagnosis for Classification of Neurodegenerative Disorders with Incomplete Multi-modal Neuroimages,"Yongsheng Pan, Yuanyuan Chen, Dinggang Shen, Yong Xia",480-489,/chapter/10.1007/978-3-030-87240-3_46,2021,5,category: classification,15,2008,2020,12
137,300,Meta-modulation Network for Domain Generalization in Multi-site fMRI Classification,"Jaein Lee, Eunsong Kang, Eunjin Jeon, Heung-Il Suk",500-509,/chapter/10.1007/978-3-030-87240-3_48,2021,5,category: classification,23,1992,2020,28
138,301,3D Brain Midline Delineation for Hematoma Patients,"Chenchen Qin, Haoming Li, Yixun Liu, Hong Shang, Hanqi Pei, Xiaoning Wang et al.",510-518,/chapter/10.1007/978-3-030-87240-3_49,2021,5,category: classification,11,2009,2020,11
139,302,Unsupervised Representation Learning Meets Pseudo-Label Supervised Self-Distillation: A New Approach to Rare Disease Classification,"Jinghan Sun, Dong Wei, Kai Ma, Liansheng Wang, Yefeng Zheng",519-529,/chapter/10.1007/978-3-030-87240-3_50,2021,5,category: classification,33,2006,2021,15
140,304,Automating Embryo Development Stage Detection in Time-Lapse Imaging with Synergic Loss and Temporal Learning,"Lisette Lockhart, Parvaneh Saeedi, Jason Au, Jon Havelock",540-549,/chapter/10.1007/978-3-030-87240-3_52,2021,5,category: classification,20,1997,2020,23
141,306,Few Trust Data Guided Annotation Refinement for Upper Gastrointestinal Anatomy Recognition,"Yan Li, Kai Lan, Xiaoyi Chen, Li Quan, Ni Zhang",561-570,/chapter/10.1007/978-3-030-87240-3_54,2021,5,category: classification,16,2014,2020,6
142,307,Asymmetric 3D Context Fusion for Universal Lesion Detection,"Jiancheng Yang, Yi He, Kaiming Kuang, Zudi Lin, Hanspeter Pfister, Bingbing Ni",571-580,/chapter/10.1007/978-3-030-87240-3_55,2021,5,category: classification,26,2004,2021,17
143,308,Detecting Outliers with Poisson Image Interpolation,"Jeremy Tan, Benjamin Hou, Thomas Day, John Simpson, Daniel Rueckert, Bernhard Kainz",581-591,/chapter/10.1007/978-3-030-87240-3_56,2021,5,category: classification,33,2000,2021,21
144,309,MG-NET: Leveraging Pseudo-imaging for Multi-modal Metagenome Analysis,"Sathyanarayanan N. Aakur, Sai Narayanan, Vineela Indla, Arunkumar Bagavathi, Vishalini Laguduva Ramnath, Akhilesh Ramachandran",592-602,/chapter/10.1007/978-3-030-87240-3_57,2021,5,category: classification,31,2003,2021,18
145,310,Multimodal Multitask Deep Learning for X-Ray Image Retrieval,"Yang Yu, Peng Hu, Jie Lin, Pavitra Krishnaswamy",603-613,/chapter/10.1007/978-3-030-87240-3_58,2021,5,category: classification,30,1998,2021,23
146,311,Linear Prediction Residual for Efficient Diagnosis of Parkinson’s Disease from Gait,"Shanmukh Alle, U. Deva Priyakumar",614-623,/chapter/10.1007/978-3-030-87240-3_59,2021,5,category: classification,22,1975,2021,46
147,312,Primary Tumor and Inter-Organ Augmentations for Supervised Lymph Node Colon Adenocarcinoma Metastasis Detection,"Apostolia Tsirikoglou, Karin Stacke, Gabriel Eilertsen, Jonas Unger",624-633,/chapter/10.1007/978-3-030-87240-3_60,2021,5,category: classification,24,2000,2021,21
148,313,Radiomics-Informed Deep Curriculum Learning for Breast Cancer Diagnosis,"Giacomo Nebbia, Saba Dadsetan, Dooman Arefan, Margarita L. Zuley, Jules H. Sumkin, Heng Huang et al.",634-643,/chapter/10.1007/978-3-030-87240-3_61,2021,5,category: classification,23,1988,2021,33
149,314,Lung Cancer Risk Estimation with Incomplete Data: A Joint Missing Imputation Perspective,"Riqiang Gao, Yucheng Tang, Kaiwen Xu, Ho Hin Lee, Steve Deppen, Kim Sandler et al.",647-656,/chapter/10.1007/978-3-030-87240-3_62,2021,5,category: classification,28,1976,2021,45
150,315,Co-graph Attention Reasoning Based Imaging and Clinical Features Integration for Lymph Node Metastasis Prediction,"Hui Cui, Ping Xuan, Qiangguo Jin, Mingjun Ding, Butuo Li, Bing Zou et al.",657-666,/chapter/10.1007/978-3-030-87240-3_63,2021,5,category: classification,19,2015,2021,6
151,316,"Deep Orthogonal Fusion: Multimodal Prognostic Biomarker Discovery Integrating Radiology, Pathology, Genomic, and Clinical Data","Nathaniel Braman, Jacob W. H. Gordon, Emery T. Goossens, Caleb Willis, Martin C. Stumpe, Jagadish Venkataraman",667-677,/chapter/10.1007/978-3-030-87240-3_64,2021,5,category: classification,21,1947,2021,74
152,318,Combining 3D Image and Tabular Data via the Dynamic Affine Feature Map Transform,"Sebastian Pölsterl, Tom Nuno Wolf, Christian Wachinger",688-698,/chapter/10.1007/978-3-030-87240-3_66,2021,5,category: classification,29,1972,2021,49
153,320,GKD: Semi-supervised Graph Knowledge Distillation for Graph-Independent Inference,"Mahsa Ghorbani, Mojtaba Bahrami, Anees Kazi, Mahdieh Soleymani Baghshah, Hamid R. Rabiee, Nassir Navab",709-718,/chapter/10.1007/978-3-030-87240-3_68,2021,5,category: classification,30,2002,2021,19
154,321,Predicting Esophageal Fistula Risks Using a Multimodal Self-attention Network,"Yulu Guan, Hui Cui, Yiyue Xu, Qiangguo Jin, Tian Feng, Huawei Tu et al.",721-730,/chapter/10.1007/978-3-030-87240-3_69,2021,5,category: classification,22,2016,2021,5
155,322,Hybrid Aggregation Network for Survival Analysis from Whole Slide Histopathological Images,"Jia-Ren Chang, Ching-Yi Lee, Chi-Chung Chen, Joachim Reischl, Talha Qaiser, Chao-Yuan Yeh",731-740,/chapter/10.1007/978-3-030-87240-3_70,2021,5,category: classification,23,1997,2020,23
156,323,Intracerebral Haemorrhage Growth Prediction Based on Displacement Vector Field and Clinical Metadata,"Ting Xiao, Han Zheng, Xiaoning Wang, Xinghan Chen, Jianbo Chang, Jianhua Yao et al.",741-751,/chapter/10.1007/978-3-030-87240-3_71,2021,5,category: classification,27,2001,2021,20
157,324,AMINN: Autoencoder-Based Multiple Instance Neural Network Improves Outcome Prediction in Multifocal Liver Metastases,"Jianan Chen, Helen M. C. Cheung, Laurent Milot, Anne L. Martel",752-761,/chapter/10.1007/978-3-030-87240-3_72,2021,5,category: classification,23,1996,2021,25
158,325,"Survival Prediction Based on Histopathology Imaging and Clinical Data: A Novel, Whole Slide CNN Approach","Saloni Agarwal, Mohamedelfatih Eltigani Osman Abaker, Ovidiu Daescu",762-771,/chapter/10.1007/978-3-030-87240-3_73,2021,5,category: classification,20,1982,2020,38
159,326,Beyond Non-maximum Suppression - Detecting Lesions in Digital Breast Tomosynthesis Volumes,"Yoel Shoshan, Aviad Zlotnick, Vadim Ratner, Daniel Khapun, Ella Barkan, Flora Gilboa-Solomon",772-781,/chapter/10.1007/978-3-030-87240-3_74,2021,5,category: classification,15,1999,2021,22
160,327,A Structural Causal Model for MR Images of Multiple Sclerosis,"Jacob C. Reinhold, Aaron Carass, Jerry L. Prince",782-792,/chapter/10.1007/978-3-030-87240-3_75,2021,5,category: classification,34,2008,2021,13
161,328, $$\mathsf {EMA}$$ EMA : Auditing Data Removal from Trained Models,"Yangsibo Huang, Xiaoxiao Li, Kai Li",793-803,/chapter/10.1007/978-3-030-87240-3_76,2021,5,category: classification,19,1996,2020,24
162,329,AnaXNet: Anatomy Aware Multi-label Finding Classification in Chest X-Ray,"Nkechinyere N. Agu, Joy T. Wu, Hanqing Chao, Ismini Lourentzou, Arjun Sharma, Mehdi Moradi et al.",804-813,/chapter/10.1007/978-3-030-87240-3_77,2021,5,category: classification,34,2013,2021,8
163,330,Projection-Wise Disentangling for Fair and Interpretable Representation Learning: Application to 3D Facial Shape Analysis,"Xianjing Liu, Bo Li, Esther E. Bron, Wiro J. Niessen, Eppo B. Wolvius, Gennady V. Roshchupkin",814-823,/chapter/10.1007/978-3-030-87240-3_78,2021,5,category: classification,21,2003,2021,18
164,331,Attention-Based Multi-scale Gated Recurrent Encoder with Novel Correlation Loss for COVID-19 Progression Prediction,"Aishik Konwer, Joseph Bae, Gagandeep Singh, Rishabh Gattu, Syed Ali, Jeremy Green et al.",824-833,/chapter/10.1007/978-3-030-87240-3_79,2021,5,category: classification,15,2014,2021,7
165,332,Two-Stage Self-supervised Cycle-Consistency Network for Reconstruction of Thin-Slice MR Images,"Zhiyang Lu, Zheng Li, Jun Wang, Jun Shi, Dinggang Shen",3-12,/chapter/10.1007/978-3-030-87231-1_1,2021,6,category: classification,20,2008,2020,12
166,334,TarGAN: Target-Aware Generative Adversarial Networks for Multi-modality Medical Image Translation,"Junxiao Chen, Jia Wei, Rui Li",24-33,/chapter/10.1007/978-3-030-87231-1_3,2021,6,category: classification,21,2015,2021,6
167,335,Synthesizing Multi-tracer PET Images for Alzheimer’s Disease Patients Using a 3D Unified Anatomy-Aware Cyclic Adversarial Network,"Bo Zhou, Rui Wang, Ming-Kai Chen, Adam P. Mecca, Ryan S. O’Dell, Christopher H. Van Dyck et al.",34-43,/chapter/10.1007/978-3-030-87231-1_4,2021,6,category: classification,18,2004,2021,17
168,337,TransCT: Dual-Path Transformer for Low Dose Computed Tomography,"Zhicheng Zhang, Lequan Yu, Xiaokun Liang, Wei Zhao, Lei Xing",55-64,/chapter/10.1007/978-3-030-87231-1_6,2021,6,category: classification,34,2006,2021,15
169,342,InDuDoNet: An Interpretable Dual Domain Network for CT Metal Artifact Reduction,"Hong Wang, Yuexiang Li, Haimiao Zhang, Jiawei Chen, Kai Ma, Deyu Meng et al.",107-118,/chapter/10.1007/978-3-030-87231-1_11,2021,6,category: classification,32,1987,2021,34
170,343,Depth Estimation for Colonoscopy Images with Self-supervised Learning from Videos,"Kai Cheng, Yiting Ma, Bin Sun, Yang Li, Xuejin Chen",119-128,/chapter/10.1007/978-3-030-87231-1_12,2021,6,category: classification,23,2014,2021,7
171,345,Multi-contrast MRI Super-Resolution via a Multi-stage Integration Network,"Chun-Mei Feng, Huazhu Fu, Shuhao Yuan, Yong Xu",140-149,/chapter/10.1007/978-3-030-87231-1_14,2021,6,category: classification,28,2007,2021,14
172,347,Real-Time Mapping of Tissue Properties for Magnetic Resonance Fingerprinting,"Yilin Liu, Yong Chen, Pew-Thian Yap",161-170,/chapter/10.1007/978-3-030-87231-1_16,2021,6,category: classification,22,1997,2020,23
173,351,Self Context and Shape Prior for Sensorless Freehand 3D Ultrasound Reconstruction,"Mingyuan Luo, Xin Yang, Xiaoqiong Huang, Yuhao Huang, Yuxin Zou, Xindi Hu et al.",201-210,/chapter/10.1007/978-3-030-87231-1_20,2021,6,category: classification,18,2003,2020,17
174,353,A Neural Framework for Multi-variable Lesion Quantification Through B-Mode Style Transfer,"SeokHwan Oh, Myeong-Gee Kim, Youngmin Kim, Hyuksool Kwon, Hyeon-Min Bae",222-231,/chapter/10.1007/978-3-030-87231-1_22,2021,6,category: classification,25,1978,2021,43
175,355,Dual-Domain Adaptive-Scaling Non-local Network for CT Metal Artifact Reduction,"Tao Wang, Wenjun Xia, Yongqiang Huang, Huaiqiang Sun, Yan Liu, Hu Chen et al.",243-253,/chapter/10.1007/978-3-030-87231-1_24,2021,6,category: classification,32,1978,2021,43
176,357,Adaptive Squeeze-and-Shrink Image Denoising for Improving Deep Detection of Cerebral Microbleeds,"Hangfan Liu, Tanweer Rashid, Jeffrey Ware, Paul Jensen, Thomas Austin, Ilya Nasrallah et al.",265-275,/chapter/10.1007/978-3-030-87231-1_26,2021,6,category: classification,36,1994,2021,27
177,358,3D Transformer-GAN for High-Quality PET Reconstruction,"Yanmei Luo, Yan Wang, Chen Zu, Bo Zhan, Xi Wu, Jiliu Zhou et al.",276-285,/chapter/10.1007/978-3-030-87231-1_27,2021,6,category: classification,17,2007,2021,14
178,360,U-DuDoNet: Unpaired Dual-Domain Network for CT Metal Artifact Reduction,"Yuanyuan Lyu, Jiajun Fu, Cheng Peng, S. Kevin Zhou",296-306,/chapter/10.1007/978-3-030-87231-1_29,2021,6,category: classification,28,1987,2021,34
179,362,Conditional GAN with an Attention-Based Generator and a 3D Discriminator for 3D Medical Image Generation,"Euijin Jung, Miguel Luna, Sang Hyun Park",318-328,/chapter/10.1007/978-3-030-87231-1_31,2021,6,category: classification,30,2006,2020,14
180,364,Rician Noise Estimation for 3D Magnetic Resonance Images Based on Benford’s Law,"Rosa Maza-Quiroga, Karl Thurnhofer-Hemsi, Domingo López-Rodríguez, Ezequiel López-Rubio",340-349,/chapter/10.1007/978-3-030-87231-1_33,2021,6,category: classification,27,1995,2020,25
181,365,Deep J-Sense: Accelerated MRI Reconstruction via Unrolled Alternating Optimization,"Marius Arvinte, Sriram Vishwanath, Ahmed H. Tewfik, Jonathan I. Tamir",350-360,/chapter/10.1007/978-3-030-87231-1_34,2021,6,category: classification,27,1994,2021,27
182,367,High-Resolution Hierarchical Adversarial Learning for OCT Speckle Noise Reduction,"Yi Zhou, Jiang Li, Meng Wang, Weifang Zhu, Yuanyuan Peng, Zhongyue Chen et al.",372-381,/chapter/10.1007/978-3-030-87231-1_36,2021,6,category: classification,17,2002,2021,19
183,370,Sequential Lung Nodule Synthesis Using Attribute-Guided Generative Adversarial Networks,"Sungho Suh, Sojeong Cheon, Dong-Jin Chang, Deukhee Lee, Yong Oh Lee",402-411,/chapter/10.1007/978-3-030-87231-1_39,2021,6,category: classification,11,2014,2019,5
184,371,A Data-Driven Approach for High Frame Rate Synthetic Transmit Aperture Ultrasound Imaging,"Yinran Chen, Jing Liu, Jianwen Luo, Xiongbiao Luo",412-420,/chapter/10.1007/978-3-030-87231-1_40,2021,6,category: classification,17,1992,2020,28
185,372,Interpretable Deep Learning for Multimodal Super-Resolution of Medical Images,"Evaggelia Tsiligianni, Matina Zerva, Iman Marivani, Nikos Deligiannis, Lisimachos Kondi",421-429,/chapter/10.1007/978-3-030-87231-1_41,2021,6,category: classification,30,2004,2020,16
186,377,SA-GAN: Structure-Aware GAN for Organ-Preserving Synthetic CT Generation,"Hajar Emami, Ming Dong, Siamak P. Nejad-Davarani, Carri K. Glide-Hurst",471-481,/chapter/10.1007/978-3-030-87231-1_46,2021,6,category: classification,30,2010,2020,10
187,379,Ultrasound Video Transformers for Cardiac Ejection Fraction Estimation,"Hadrien Reynaud, Athanasios Vlontzos, Benjamin Hou, Arian Beqiri, Paul Leeson, Bernhard Kainz",495-505,/chapter/10.1007/978-3-030-87231-1_48,2021,6,category: classification,26,1979,2020,41
188,380,EchoCP: An Echocardiography Dataset in Contrast Transthoracic Echocardiography for Patent Foramen Ovale Diagnosis,"Tianchen Wang, Zhihe Li, Meiping Huang, Jian Zhuang, Shanshan Bi, Jiawei Zhang et al.",506-515,/chapter/10.1007/978-3-030-87231-1_49,2021,6,category: classification,21,1984,2020,36
189,381,Transformer Network for Significant Stenosis Detection in CCTA of Coronary Arteries,"Xinghua Ma, Gongning Luo, Wei Wang, Kuanquan Wang",516-525,/chapter/10.1007/978-3-030-87231-1_50,2021,6,category: classification,18,2007,2020,13
190,382,Training Automatic View Planner for Cardiac MR Imaging via Self-supervision by Spatial Relationship Between Views,"Dong Wei, Kai Ma, Yefeng Zheng",526-536,/chapter/10.1007/978-3-030-87231-1_51,2021,6,category: classification,25,2011,2020,9
191,383,Phase-Independent Latent Representation for Cardiac Shape Analysis,"Josquin Harrison, Marco Lorenzi, Benoit Legghe, Xavier Iriart, Hubert Cochet, Maxime Sermesant",537-546,/chapter/10.1007/978-3-030-87231-1_52,2021,6,category: classification,13,2009,2020,11
192,384,Cardiac Transmembrane Potential Imaging with GCN Based Iterative Soft Threshold Network,"Lide Mu, Huafeng Liu",547-556,/chapter/10.1007/978-3-030-87231-1_53,2021,6,category: classification,14,2001,2020,19
193,386,TVnet: Automated Time-Resolved Tracking of the Tricuspid Valve Plane in MRI Long-Axis Cine Images with a Dual-Stage Deep Learning Pipeline,"Ricardo A. Gonzales, Jérôme Lamy, Felicia Seemann, Einar Heiberg, John A. Onofrey, Dana C. Peters",567-576,/chapter/10.1007/978-3-030-87231-1_55,2021,6,category: classification,18,2006,2021,15
194,387,Deep Open Snake Tracker for Vessel Tracing,"Li Chen, Wenjin Liu, Niranjan Balu, Mahmud Mossa-Basha, Thomas S. Hatsukami, Jenq-Neng Hwang et al.",579-589,/chapter/10.1007/978-3-030-87231-1_56,2021,6,category: classification,28,1956,2021,65
195,390,Renal Cell Carcinoma Classification from Vascular Morphology,"Rudan Xiao, Eric Debreuve, Damien Ambrosetti, Xavier Descombes",611-621,/chapter/10.1007/978-3-030-87231-1_59,2021,6,category: classification,37,1967,2021,54
196,391,Learning More for Free - A Multi Task Learning Approach for Improved Pathology Classification in Capsule Endoscopy,"Anuja Vats, Marius Pedersen, Ahmed Mohammed, Øistein Hovde",3-13,/chapter/10.1007/978-3-030-87234-2_1,2021,7,category: classification,26,1993,2020,27
197,392,Learning-Based Attenuation Quantification in Abdominal Ultrasound,"Myeong-Gee Kim, SeokHwan Oh, Youngmin Kim, Hyuksool Kwon, Hyeon-Min Bae",14-23,/chapter/10.1007/978-3-030-87234-2_2,2021,7,category: classification,18,1995,2021,26
